dates,reviews,comments
6/26/2017,5,"The food is awesome. Their poké bowls are so flavorful, and satisfying as well. The bento box is a good deal if you want to try a little bit of everything. I'd also recommend their kawaii rolls.Service usually very fast, and the staff is friendly. The place is kept neat and has a chill, fun vibe."
3/24/2019,4,It's a good way to have semi fast Japanese (?) food. Love the bento box. Has a nice assortment of items in one plate. Pretty quick but super busy!!
9/20/2018,3,"Bento helped me survive college at UF. It offered such a great array of Asian cuisines and became my comfort food shortly after opening. My orders were always simple. Beef Bulgogi Bento with extra spicy mayo OR Chirashi Don (with extra spicy mayo) AND a taro or almond milk tea with boba. When they started delivering, it was life changing, except delivery times were often REALLY LONG, so we just had to plan accordingly. So I was STOKED when I saw Bento had opened near my parents in Plantation and rushed to find out if it was the same great spot I knew and loved. Well, we couldn't get in to eat, so this review is based on their boba tea alone. We ordered two jasmine milk teas with boba. The jasmine was so strong it tasted like drinking perfume. The boba were kinda chalky in the center, as in undercooked. Definitely not delicately chewy like I'm used to in these drinks. So all told, these were bad. We reported it to the staff and they were quick to remedy the situation, whipping up two new Thai milk teas for us with fresh boba that were much better! I'm excited to get back home for a visit and eat here next time! I'm sure the rating will go up from there!"
1/10/2020,5,"I don't get to come here often, but when I do it is always consistently good food and service. I ordered the pad thai, which was extremely flavorful and a few rolls which were all good as well. Parking is always a little crowded since there are many businesses in the plaza, but they are not to blame. The seating is adequate for personal meetups and business chats as well. Glad they are opening a pembroke pines location near me, as I know i'd become a regular."
9/17/2016,5,"Been a fan since my early college days, visiting their locations in Gainesville and Orlando, and super happy they have finally opened one in South Florida!The thing I love about Bento Cafe -- options and customization! On the Asian Kitchen side of the menu, there are various hot meals you can order in forms of a rice bowl, a noodle bowl (lo mein, udon, or mini udon), or a bento box (yes, comes with other sides, pick this if you like more variety!). On the Sushi side, there are rolls and dons (donburi aka rice bowls) but there's the option to build your own too. I've never had the BYO option up north Bentos before so I like this new implementation, expanding your menu options to cater to your cravings. For the rice bowls, you can choose your own rice, 3 proteins, 4 toppings, and your sauces. Also, they have milk teas, green teas, and smoothies which are also customizable -- choose whether you want boba (large tapioca pearls), jellies, or popping boba). For those who really know me, I'm all about trying something new on the menu, but whenever I visited the Bento Cafes up north, I only had one craving: Spicy Cream. That is exactly what I got last Thursday night. Got the Spicy Cream shrimp on a bed of mini udon noodles. Comes with a side of garlic buttery green beans, which compliments the dish pretty well. Each flavor-packed bite brought nostalgia to my tastebuds, and despite how busy it was that evening, the wait from the long line was worth it! My honey got a Build Your Own poke bowl, which was super delish and fresh! They have A LOT of various options, even with proteins (not only just salmon and tuna but even poke versions and spicy versions, etc). By far the most extensive BYOB (build your own bowl) menu I've seen in SoFlo in regards to rice bowls and I am super excited to make my own bowl the next time I go back!For the teas, the honey got iced Thai tea and I got myself a honeydew milk tea boba with lychee jellies. I love their boba -- not too soft, not too chewy, just right!Great, fast service and super affordable. It was packed that night and it's only a soft opening on their very first week, so I'm glad Bento has a pretty good following. I'm also glad it's much closer now, because that means I can visit more often and try new dishes! OH, and I get the feeling this is the Red location because the decor was primarily red. Perhaps they'll open a Blue location soon? One can only hope! Heh, just a fan theory...Thanks for being a part of my college life, Bento Cafe, and I look forward to many more memories with you in present time with this new hot spot!"
5/1/2021,1,"The worst Bento I have ever been to. The wait times are outrageous for mediocre food. They have signs plastered everywhere saying they are ""understaffed"" yet there are at least 10 employees (not including in the kitchen) running around confused.  I ordered two bowls to go today, and my two friends eating in got their food first, and my food was still nowhere to be found 30 minutes later. I went up to ask, and they forgot about my order and just started making it when I asked. I get home and the bowl is about half filled what it normally is. Not only has the price increased on bowls, I waited nearly 45 minutes for a to go order in a not crowded restaurant, I got almost no food for 30 dollars. Save your money or order well in advance online."
10/13/2016,4,"Davie has suddenly become the nucleus for new restaurants.  The massive development of Tower Shops continues and Bento Cafe is the latest new tenant.  I really like the Chipolte-izing of fast casual restaurants.  This is a build your own type place for Asian cuisine.  Although you do not walk through an assembly line of ingredients like at Chipotle or Blaze, you do get to customize your order.  Being a fan of Poke from first trying it in Hawaii, I had to go for the Poke Bowl.  The options are truly endless, but I settled with Spicy Tuna & Spicy Salmon for my proteins and seaweed salad (wakame), dried seaweed (nori), and mango for my ingredients.  I had it on a salad instead of rice as I was trying to cut carbs.  For beverage I went with a large Taro flavored milk tea.The wait for the food was not long, the tea came out first and then the food shortly after.  The bowl was oh soooooo good!  I didn't like the salad underneath too much so maybe I'll try the rice.  You can also customize a ramen bowl which I am excited to try as well. The tea was as delicious as the ones at 545 Bahh Mi. I love me a good tapioca ball.  I've also had the Bento Box, I chose the Korean steak as the protein.  I found it to be a bit disappointing it was not spicy at all despite it being a spicy item on the menu.  Also I didn't like having noodles AND rice.  Once carb is probably enough.  The salad is eh and the sugar wonton desert sucks.  I would stick to the Poke bowls.Overall it was a great experience and I would come again.  My only advice would be to come earlier to beat the lunch rush as the line was pretty long when we  went."
10/19/2018,4,"Bento is my solid go-to in Davie for takeout or a quick lunch. They have customizable rice or noodle bowls, bento boxes, poke bowls, sushi, and lots of sides like edamame and veggie spring rolls. They also have a make-your-own boba tea which is pretty cool! The only things I don't love about Bento--They have freestyle coke machine, but no option for unsweetened iced tea which is my beverage of choice. -All the drink cups are one size. Fine for dining in when you can get a refill, but pretty small for the price if you're doing takeout. Their water cups are just as big or a little bigger than the cups you purchase for a drink. -There are up-charges for changing out veggies. For example, I usually get the orange chicken with snow peas and green beans instead of peppers, and there is $1 charge for each vegetable that I add even though I'm taking away the original vegetable it comes with. I wish substitutions were not extra because my $9 bowl can turn into a $13 bowl if I'm adding veggies and extra sauce. Other than that, I love Bento. The quality of the food is great for the price, the portions are perfect, and service has always been fast and friendly for me. Actually, surprisingly friendly staff for a counter service restaurant. Sometimes the lines are long, but they move quickly, and it's totally worth it!"
9/11/2016,5,"Bento Group expands to South Florida! The fresh fast food sushi and Asian fusion hot spot opens in the Trader Joe's shopping plaza near Nova, Tower Shops.You order food at the counter, from the hot food menu or the sushi menu. They have bento boxes, noodle and rice bowls, Poke bowls, sushi rolls and bowls... lots to choose from!I went with my usual favorite, the tuna + salmon don, which is a sushi bowl. They give a huge portion of sashimi and rice, and it's topped with avocado and spicy mayo. Bento also has a list of boba tea/smoothie/slush and flavors. I got the Jasmine milk tea with boba. I personally don't like flavor in my milk tea, but they offer taro, vanilla, Thai tea, and many other flavors. The boba is soft and sweet to taste.Service is fast and servers walk around tending to tables' needs, but the atmosphere is casual and self seating. Pro-tip: call ahead to pick up your order and skim the line!"
11/6/2018,4,"Fast food Asian fusion cafe.  A lot of tasty options here to choose from depending on what you are in the mood for.  There must have been 100 people in this restaurant and despite that, i must say that the service was pretty quick. Parking is a pain during lunch, so just go ahead and park across over by Office Depot area.I ordered the Bento Fried Rice and the portion was decent and food itself had lots of flavor. I think next time, i'm going with the Poke as everyone is telling me to try that next.I must say, the bathrooms were very clean and the soda fountain area was very neatly organized."
11/13/2018,5,Bento Asian Kitchen & Sushi is one of my favorites spots to visit whenever I'm in the Davie area. If it means stopping in for some Lychee Green Tea Bubble Tea w Tapioca or actually sitting down to enjoy my meal then I'm there. My bf actually dislikes how much I enjoy this place but for some reason I'm always coming back. Bento is typically a line-out-the-door (we hope you know your order by the time you get to the register) kinda place. That has to tell you something about a place when it's constantly packed 25/8. You may feel deterred to come in and see quite a lengthy line but I promise they work through that line as quickly as possible. There's typically always 3-4 people working the cash register so don't worry about why 1-2 people are taking care of a line of 15+ people lol. (They have it covered)As I said I typically order a Sm Lychee Green Tea bubble tea with Tapioca and then a Florida Roll with (NO cream cheese) . This time that I visited I ordered:- Miso Soup- Lychee Green Tea bubble tea w Tapioca- Florida roll- Chicken Teriyaki BowlEverything came up to about $24 and the food got to the table almost minutes after we chose a spot and got drinks and utensils. I recommend anyone who wants a tasty lunch to visit!
9/27/2018,5,"I LOVE BENTOS!!! I swear I've been to several I mean several of sushi spots in both Orlando and Miami and I always come back to Bentos. Bentos is one of my favorite sushi spots. Gotta love them.My favorite rolls of all time are The Special Mexican and the Mount Fuji rolls. You have the option to order a half or full roll if you're feeling reall hungry. The prices are always reasonable too and the service is fast as well. I've  been to other fancy high end sushi places and nothing beats Bentos honestly, hands down. I definitely recommend this spot!"
8/21/2020,5,SO GASSSSSSSS this was my first time trying boba tea and It was love at first sight. The texture is amazing and the tea is delicious. The order came in fast too. The poke bowls r a rlly good size (mini in the photo) and they r fresh asf. My total was $12.86 which is SO GOOD for poke and boba tea. Every other place I've been to is overpriced. 173829201/10 this place has my heart
9/6/2021,1,Pictures are deceiving. I ordered the Mongolian beef bento box with white rice. $18 for 5 or 6 pieces of bland steak. I could have went to Pei Wei for almost half the price and got better flavor. Complete waste of money. Never again.
12/1/2019,4,"I've been a fan of Bento ever since college back at UF. I was so excited to see that they had a location in Davie. They are planning to open up a spot in Pembroke Pines near the Publix on Pines and Palm! My fave dish here is the Pao Pao Chicken (battered, fried chicken in sweet and sour + spicy mayo sauce). I like it in a bowl of rice or udon noodles or in the Bento box. Most things here are pretty satisfying depending on if you like savory versus sweet dishes. Service is decent and pretty fast."
10/28/2018,3,"Being in Bento 3 times.We got there around 9PM and ordered there was no lines!While I went to the bathroom the food was already out, they are super fast, but its the second time I come over that they forget an item we ordered!We asked for two ordes of the Rangoons, we got one and they forgot about the other one, 10 minutes later we stand up to go complain about it, and the girl who was bringing the food came over our table and asked if we were missing a order of the Rangoons and we said yes we are, 5 minutes later we got it!I ordered the Noodle Bowl, vegetable Stir Fry with chicken, was awesome their food is pretty good and no complaints about it! They just have to be a little more attentive on what you ordered, being there 3 times and they forgot a item in two different occasions!"
4/10/2019,5,"So yummy My mom and I were always eye-ing this place but each time the line was crazy, but today it was kind of slow so we went in. The menu isnt hard but you have a lot of choices and options. The cashier was so sweet and helpful, told her it was our first time so she explained some of the toppings to us. We got two mini poke bowls, my mom with tuna and mines with salmon they filled us up! Even the drinks are good, I hate washing my food down with soda and here you can get beer, rice wine, tea, and so much more. Also the cashier let me get my tea without boba, wooohoo!"
12/12/2018,2,"Very disappointing. I was in the area shopping and needed to get a quick lunch. I looked up Yelp reviews,  and this seemed like a good place to try. It's a medium sized clean location where the food is fresh and the customer service is great. The menu is huge - there are so many choices that as a first timer, it was a bit overwhelming.  You have to study the menu before you order unless you are familiar with it....which allows you to try new things each time. I decided on a shrimp tempura appetizer, and a  bento box with white rice and spicy bulgogi (all bento boxes come with ginger salad, lo mein, green beans and a small dessert of a few pieces of  fried won tons with a sweet sauce over it) . You get a number and sit down and a runner brings you your order when it's done . All of that should add up to a great experience.If only the food were as good. The shrimp tempura consisted of 4 ""big"" shrimp with dipping sauce for $7.99. Unfortunately there was  too much batter that made the shrimp seem big, and they tasted only like the oil they were fried in ( yuck - that needed to be changed). The dipping sauce was not the ""usual"" but seemed more vinegar than soy sauce base.I usually love spicy bulgogi, (spicy marinated beef, scallion and onion) $11.99,  but I did not like their version. It had a strange aftertaste - maybe hoisan sauce? Not sure but I did not care for it. The white rice was hot and good, but the lo mein was cold,  tasteless and dry. The green beans were good, but barely warm. The ginger salad was ok,  but fried won tons with the sweet  sauce were not.So for $22, I really didn't think it was worth it. I will say there are many things to try, and maybe if the sides had been good I would be more eager to try again. And maybe I still will - but with so many Asian  restaurants around, the fact that the shrimp and beef were both not good makes me think probably not."
6/7/2018,4,"Bento Café, welcome to South Florida! Going to school in Gainesville Bento was my no. 1 spot to go for fast casual sushi. When I heard they opened close to my neck of the woods I had to make it out there.YUM! Still just as good as I remember it with friendly and fast service, too.From poke bowls to sushi rolls, their menu is packed with deliciousness. I got the chirashi bowl which was filled with fresh sashimi over a bed of sushi rice. This is a fast casual spot so you order at the counter and they bring your food to you.They offer a make your own poke bowl which is great too. My dining mate added mango to their salmon and tuna poke and it was most definitely photo worthy. Pricing here is on point. Portions are generous for the price too which makes me heart eye emoji the heck out of bento. The parking is plentiful too, although this plaza does get hella busy so you may need to walk a little. Bento, I'm so happy you made your way from Gainesville to Davie. Welcome!"
9/12/2016,5,"Going to college in Florida, everyone who's gone to UF or even UCF should have some recollection of visiting Bento Cafe at least once in their life (and if not, you're missing out). Being here for optometry rotations, I was ecstatic knowing they'd be opening relatively close to my family's house. Like all the other locations, decor is a modern Asian feel with their signature red theme (most locations are either red or blue). Cool music playing and plenty of seating. It's located within a plaza so there is ample parking spaces. Bento Cafe offers a delicious variety of Asian food and sushi alongside a boba tea bar. Between every location, a few menu items are different and/or absent, but the favorites always remain. If you crave hot food, my personal recommendations include beef bulgogi, curry katsu, Mongolian steak, and my ultimate favorite: spicy cream. For these dishes, you choose the entree and then you can pick between a rice bowl, noodle bowl, or a bento box (comes with different sides: lo mein, salad, string beans, and rice). For sushi, my personal recommendations include the special Mexican, mt. Fuji, hot lava, and Miami roll. DON'T FORGET THE SPICY MAYO. Their recipe is unique and packs a lot of flavor unlike most other restaurants in the area. Boba is delicious and I always favor taro, matcha, strawberry, mango, (and even a combo strawberry mango), etc. All is good!Dishes range from $4-$10 which is why this place is a STEAL. For what it's worth, this place is BOMB, super affordable, and a cool place to hang out."
9/21/2019,5,"I can't believe I haven't done a review for this fusion spot yet. Originally was introduced to Bento in downtown Orlando. This spot is modern, clean, and has a nice relaxed environment. The service is fast and efficient. Order your food at the counter and have it brought to your table. I order the same thing here all the time which is the pao pao chicken with white rice in a bowl. My all time favorite dish. I've tried a few other dishes and I can't order anything else. The staff is very friendly, plenty of seating, and you may need to park a few ways since it's always busy. The sushi isn't bad, wasn't a fan of the boba tea, and they have an array of drinks. Walk over a little after you finish your entree to phenomenal ice cream and bake shop for some dessert."
11/16/2019,4,"This was my first time hearing about or patronizing this restaurant. I stopped in with a friend for an early dinner, & although the establishment looks like a typical chain restaurant, I was impressed with the quality and taste of the food. The menu has quite a few options & I was happy to see a variety of sushi options on the menu. I ordered a Mongolian beef white rice bowl & a sushi box with 4 Mt Fugi rolls. My rice bowl was delivered to my table very quickly & my sushi followed awhile after but I could tell there was a wait for sushi based on the customers lined up in front of the station who weren't dinning in. Both were very tasty. Portion size fit the pricing. My only complaint was the restaurant was uncomfortably cold to an extreme I've never experienced before. It being chilly outside did not make it any better. Tables come with chopsticks, however there are no other silverware, napkins or condiments available which is a slight inconvenience. Especially with the food being delivered to the table, however there is a station in the back corner of the restaurant where all these items can be found. I would patronize this restaurant again."
6/13/2018,4,"This place is quite the gem, it's a little difficult to get to but it's total worth it. It's definitely your money's worth and it's not overly expensive!I ordered the garlic chicken broccoli bento & sautéed mixed vegetables with chicken an green tea passionfruit boba tea. The bentos were amazing, flavorful and a good amount I was very happy with it. As for the boba tea, a bit disappointed. The tea was very bitter, I'm not sure if it was a new batch, the tapioca was small and not great in texture. Can probably get boba tea somewhere else for a better price and flavor. Besides that, there was a long line which I though would take forever but it was so quick. Great customer service. I can not wait to come back and try more bento boxes!!"
9/24/2016,5,"Recently opened up in the same plaza as Bestbuy.  As a Asian from Los Angeles who had numerous good options, Bento has quality options.Since its new, it does get quite busy with a long line to order. I had the Szechuan Beef Noodle Soup. It was surprisingly good, almost on the same level as Beef Noodle Soup (Niu Rou Mian) in LA. Order it with the mini Udon noodles.I also had a make your own Pokebowl. With the option of brown rice or white rice, or vegetable bottom. The option for 3 proteins is great. The quality of the fish was superb, flavored really well, and super soft and fresh. The Salmon poke, Tuna poke and marinated salmon were great options."
9/20/2016,5,"So exciiiiiited to have a Bento in SoFlo! The long awaited opening of this location is finally over. It's located right off of 595 in Davie in the Tower Shoppes newest building along with other businesses new to the plaza. It's a 'wait in line to order and they'll bring your food and drinks to you' type restaurant, which from a business POV is probably a smarter choice to get people in and out quicker, but it sucks when the line can be out the door. My Bento loving bf and I ordered the beef bulgogi rice bowl along with the Crunch sushi roll. Both were really yummy  no complaints there. I'm in a miso soup phase, so there was also an order of that and I was recommended to try the jasmine milk tea by a friend - both were also delish! I didn't get it with the boba b/c it was just too sweet. The wait time for the food wasn't long at all considering the amount of customers and the ambience of the place was very chic and modern. Service was also very friendly. Nonetheless, we will definitely return."
4/15/2018,4,My first visitIt could be a little intimidating not understanding everything thing on the menu. The food was excellent. It was delivered quickly and hot. We were with my grandson who made suggestionsWe will return.
11/17/2018,4,"Everything was delicious and boy the quantity of food was perfection. If, you're getting the teriyaki chicken get the extra sauce as well. It really tops off your dish. The restaurant was really busy but they had a whole lot of cashiers to cash people out so the wait time wasn't long. The only downfall is the location town shops are  busy on the weekend so it's kind of hectic to exit to get to back onto the main road. The upside the smoothies are delicious or should I say the ice smoothies are great I had a passion fruit smoothie with strawberry boba.   Now that was the piece de resistance. I would just come back for that alone. Their pumpkin spice wontons were delicious too but $5 for the quanity they give is not worth it they should bring the piece down."
2/16/2020,4,"This is my favorite sushi place. If you're not up for  rolls or sashimi, choose a poke bowl or soup. Bento has a wide selection for your Asian cravings.Bento in Davie gets my ""thumbs up!"""
12/15/2018,5,"I used to go here and order something different off the menu and always thought that it was just ""ok"". My friend told me to try the spicy cream/pow pow dish and it changed my life!! Seriously I've been going and ordering the spicy cream shrimp with udon noodles taking out the string beans and peppers and adding broccoli and it's soooo delicious! I also order a Mexican roll to share with my partner and I love it so much. I also tried the spicy cream with chicken and it's soooo delicious. It's always slammed here and now I know."
8/18/2018,5,Holy delicious Batman. This was my first bento box and I was definitely happy with the experience. The food came out really quick and they serve sake which is amazing!!I've eaten at the Orlando one that is more of a sit down with a server restaurant. Here you place your order at the counter sit down and it's delivered. I Would definitely recommend to anyone looking for a fresh bite of Asian fusion!
