dates,reviews,comments
9/27/2022,5,SOOOOO GOOOODDD!!! Super cute location & great staff! Food came quick and tasted great
7/26/2022,2,"Friendly staff and clean restaurant, but the food was unremarkable. My wife got a bento box with sautéed vegetables and I got a salmon roll and miso soup. My sushi was a bit subpar. The rice was too vinegary and the salmon, which seemed OK, had a very pale orange color to it which made me question the quality. My wife hated her bento box. The vegetables were freshly cooked but the sauce was gloppy and one dimensional. The rest of the box was unremarkable; lukewarm noodles and rice, a basic salad and some green beans. It was certainly a big portion, but it wasn't very good. We both commented how much of a shame it was that the food wasn't better. We love Park Place and eat Asian food quite often. I would come here all the time if it was good. Unfortunately, it wasn't."
12/2/2022,5,I'm originally from New York and consider myself a foodie and a tough critic. Bento Asian Kitchen + Sushi in Boca Raton exceeded my expectations. My food arrived much sooner than expected and warm.  My fried dumplings were crispy and the size of the bento box surprised me. Everything was delicious and amazing. The cherry on top had to be the little crunchy wonton crisps in their own little compartment. They were dusted w/ cinnamon and sugar and served as a great little dessert. I will definitely be ordering from them again very soon.
11/28/2022,2,"Food is decent but prices and portions do NOT correlate. I've been eating here for years and it used to be so much cheaper and you would get a decent sized portion. Went today after not going for awhile, paid 18 dollars for a poke bowl just for it be half the size of the actual bowl itself.  If I am paying almost 20 dollars for a bowl I at least expect to get a substantial amount of rice. Very disappointing, the tofu tasted pretty bad and like it's been sitting out all day and dry. Can definitely say I'm not returning here. Very sad as I used to love this place and always ate here."
8/12/2021,4,"In the mood for Asian food, I remembered my friend's suggestion to try Bento. The day came to give it a try! I walked in and place a to go order since I had limited time for lunch. The service was great, I was helped almost immediately and it didn't take too long to get my food to go. I ordered a ""spicy"" fried rice with tofu. I said ""spicy"" in quotation marks because it wasn't spicy at all. Either way it tasted delicious! It had a very pad Thai type of taste, I suspect they cook with peanut oil. It was more in the sweet side. I liked a lot even though it wasn't spicy. I also ordered boba tea. I chose a passion fruit flavor which had a green tea based with lychee pearls. It was way too sweet to my taste, but after adding a little bit of water it became perfect. I'm giving this place 4 stars because of those little details that could make it more authentic perhaps or improve. I still recommend it as a good lunch spot. The food was very tasty even if they don't hit the spicy note!"
7/19/2022,4,If your looking for affordable extra filling lunch this is it. Don't let the size mislead you. It's very yummy
10/24/2021,4,"To-go sushi, poke, and hot Asian food style restaurant. I ordered the taro milk tea with honey boba. The boba was perfectly cooked but I found the milk tea itself to be overly sweet and taste more like a milkshake. My boyfriend and I both ordered regular build your own poke bowls and honestly the bowls they serve you have so much food in them and going forward we will most definitely split one. I thought the fish portions were really generous and tasted fresh. I did find the sushi rice to be really mushy and over cooked but other than that I was pretty impressed. I would definitely go back when I'm looking for a quick dining experience."
2/13/2021,4,"3 1/2 stars. A good lunch with huge portions.  I'm a fan of bento boxes. Compartments with little bits of different foods to mix and match. Only in this case, it was large amounts different foods. You choose your meat (or tofu or shrimp) and your sauce plus white or brown rice. Each box comes with sauteed green string beans, a crisp salad with ginger dressing, and warm low mein noodles. In the middle of the box was a ""dessert"" - - crispy fried noodles with sugar and cinnamon on them. My choice of main dish was the chicken with yellow curry. It was very aromatic and had a very slight kick. In addition to copious amounts of white meat chicken breast, were carrots, green beans, zucchini, and bell peppers. It was very tasty. My husband ordered their sushi combo box. It included  an 8 piece California roll, plus his choice of two of their 4-piece classic sushi rolls. There were over a dozen choices. He also had a smaller portion of salad and some cold veggie (zucchini) topped with a miso dressing. in the box. His combo was a very large portion for the price ($12). If you don't want a large meal, they have build your own poke bowls; signature and classic sushi rolls, rice and noodle.bowls. They also have build your own boba teas/drinks. And they even have a kids meal. They were quite busy during lunch. Lots of college kids and business people in the area plus you can order and pay online. Then pickup. There is inside seating and a patio area outside, too. You order and pay at the counter and are given a number to display on your table. They deliver your meal to you. I wasn't familiar with this chain. Thank you to Howard H., fellow yelper elite, for eating here and intriguing me with his review to bookmark this location. It was a very good experience."
8/6/2022,2,"Ordered take out/ with me picking it up.  Service was slow getting checked out and food was over cooked and not that good.  I would give them a 2nd chance, not sure when."
3/4/2022,4,"Torn between 3 and 4 stars. Food was good and nicely plated! My sushi were way too salted for some reason though. My fiancé really liked his chicken. As for negatives, we had to wait for a long time for our food although it was not busy. And the prices are insanely high for what you get. The restaurant is nice and clean inside though and has a nice patio seating. Overall it was a nice lunch but we will probably not return."
2/19/2022,5,"Fresh delicious food, clean place, friendly staff. They have a hand washing station! But my favorite thing is the food."
8/19/2021,4,I just love my poké bowl full of salmon and full of sauces and fruits. They fulfilled that craving of mine without me asking. They also satisfied one of the most important aspects of a poké bowl: good and generous portion. They left me with a full stomach and a subsequent and much needed food coma. Will be coming back and try out other items on the menu for sure.
8/6/2022,1,"The food and menu looks good but don't be fooled! I got a sushi order with the scallops and was up all night vomiting. (I was unhappy with myself for ordering scallops in a place like that and thought It was my own bad decision and a fluke). But then, a few weeks later, my daughter got chicken chow mein and was up all night vomiting. Health department needs to look into this place. Will never go back."
6/23/2021,3,Bento box with chicken red curry was OK!Having rice and noodles in the same box is a bit of a mistake but the curry was super spicy and had a generous amount of chicken (too much carrot). Udon noodle bowl with tofu and broccoli was over cooked and barely edible.  I feel that it's possible to order better food with a knowledge of what's good on the menu. If you are either smart or lucky it's a cheap meal with a lot of choices.
1/9/2022,5,I've eaten here before and the food is great but my customer service experience was great.  I made a mistake in my order and they fixed it for me with a smile even though I know it could've been a pain in the butt. Great service goes a long way.  Thank you Bento!!! I will be back!!!
9/17/2022,5,Awesome family deal!   Healthy and great family will love it!  Katsu chicken is our favorite
12/30/2019,3,"This is a good place for lunch. You can make your own bento bowl, salad or get sushi! As wellas Bobo tea! You go up to the cashier to place your order and they give you a number for your table and you sit down and they bring it to you. Very casual but very good. It's good for all ages as well. It's in the same strip mall as Yoke, Prezzos and Burton's. It is reasonably priced so tang is nice. I just wish they would do an app and a loyalty program. That would make it even better."
12/22/2019,4,"I'm stopped in here for dinner after leaving the nearby CycleBar class. On Friday night, the restaurant was moderately busy, with many people placing To-Go orders.  I love the build your own bowl options, but I opted for the Hawaiian Poke Bowl, with half rice and half salad. The portion was quite large, and everything was fresh and tasty. Overall, I think it's a nice place for a quick lunch or dinner, and I love that there are some healthy options."
11/30/2019,5,"Came here a while back for lunch with a few coworkers.  This place is located in a busy plaza with different restaurants.  The original plan is to come by around 11:30am, but when by the time we arrived around noon, the line was all the way from inside the restaurant to the street.But I think it's worth the wait.  It could take an average dinner to go through their menus as they all sorts of different items from ramen, shsui to lunch bentos (duh...).  Not sure if there was a vegetarian option, but there rarely are in Asian restaurants.I decided to go with their chicken katsu, or fried pork chop.  The chicken was very tender and flavorful while the outside was crispy.  I also love their rice, it might sound simple but its not easy to make it hot, moist and fluffy.Overall it was a good, quick lunch option.  Everyone at the lunch enjoyed their food.  The staff was friendly and the line moving pretty quick while turning a lot of tables.  I'd definitely go back but may wanted to get there a bit earlier next time."
1/20/2021,5,"Whoops, I was too hungry to take a picture before I ate but it was delicious. Had a make your own poke bowl tonight and split a volcano roll. They had prepackaged utensils and sauces safely packaged. Would recommend the poke bowls."
12/7/2021,1,The food is mediocre at best but now they went cashless so don't bother trying to come here unless you have a credit card I guess they discriminate against people who can't have credit cards or bank accounts
12/7/2021,1,I sent my son here because he didn't want fresh kitchen. They refused cash payment. Cash is legal tender in this country & I feel this is discrimination..what about people who work for cash tips? Also what about people with bad credit who don't have a credit card? Shameful in this day & age..will never go here again & will let everyone we know not to go here
8/29/2019,4,"We have been to the Bento location in Davie maaaaany times while living out there and were always a fan, so we were happy to go here while house hunting in the Boca area. Bento is fast casual Asian food and has something for just about everyone which makes it an easy place to pick when you're in one of your ""I don't know what I want to eat"" moods.Both times we went they had signs they were still in their soft opening. serbice the second time was a little slower than our first which was interesting. I work in the area and although I haven't been during lunch rush I'd recommend calling/ordering ahead to make things easier. As for the food, 9 out of 10 times I pick a build your own poke bowl since it's fully customizable. You can pick rice (brown or white) or mixed greens for your base. Then you select your proteins, veggies (avocado isn't extra!), add-ons (think sesame seeds, cream cheese, etc) and your sauce. Meanwhile my husband sticks to their TNT roll - he likes how the fish on top is ""flamed"". But another reason I'm a fan of Bento is because they have boba tea! Getting boba in South FL is no easy feat so I can appreciate when it is offered. (But just a note - I'm no expert or purist on the boba tea topic but it tastes good and that's all I care about.)Hopefully service can be streamlined a bit more and it would be cool if they brought in a Freestyle Coke machine like their Davie location ;-)"
4/8/2022,1,"""Bento box"" more like shit box. Ordered the teriyaki chicken, was not cooked and no sauce. Rice was not cooked at all! Any Asian cuisine that can't cook teriyaki chicken shows a lot about the place."
4/3/2022,1,If I could leave zero stars I would.  It's been a while since I've eaten anything so disgusting. Drenched with sauce and no flavor. The Edamame was barley tolerable. Save your money.
2/12/2021,4,"Dine In is now open!Plenty of Inside and outside seating available.This new Asian food eatery has plenty of options for Sushi - Bento - Bowl creations and you will leave full and satisfied!Today for lunch I chose one of the Sushi Boxes: 8 pieces of California roll, I chose the Special Mexican roll and Florida roll to round out my order.The Special Mexican roll had Shrimp tempura, steamed shrimp, avocado,  masago, spicy mayo, cream cheese and eel sauce. The Florida roll had tuna, salmon, cucumber, cream cheese and masago. The box also had cubed zucchini and a nice salad. The California roll was good too, and with the eight pieces of California roll to go along with the four Special Mexican and four Florida roll pieces, was a lot of food!The staff is friendly and if you dine inside they give you a  numbered flag for delivery to your table when your order is ready.They do have bottled beers, cans of hard seltzer, bottled water, juices and sodas. (The fountain drinks machine was not in operation this visit so we shared a canned soft drink).There is a condiments counter where you can gather soy packets, (regular or low sodium), chopsticks,  straws, napkins, take out boxes, salt and pepper This place also looks to be popular with the young college/university set in the area. When you are hungry, lunch or dinner, this is definitely the place to come!"
2/2/2020,3,"Ordering was a bit confusing at the register since it was our first visit.  We ordered Chicken Padthai and a Poke bowl.  For a drink, we ordered a Boba Tea with popping bobas.  The drink was great.  Poke Bowl was a bit on the salty side, but plenty of fish.  The Padthai was too spicy.  Not quite the right place for us, but good to try."
3/6/2021,5,"On this particular Friday night we didn't intend on going to Bento Asian kitchen but we were so happy we did!  This restaurant is located in a strip plaza on Military Trail just north of Yamato.  This is a quick service restaurant, you walk up to the counter and order, they give you a number and they bring the food to you.  My wife and I both got bento boxes for dinner, I got the general tso's chicken and she got a garlic chicken.  We really didn't know what to expect but these ""boxes"" were huge!  They come with noodles a choice of white or brown rice and a salad. They also have different types of sushi and boba teas.  We both got the Thai Tea boba tea and for 24oz it was $5.50.  For the kids we got them the kids meals which were also quite large.  They both enjoyed their food and finished it all.  We will definitely go back!!!"
1/12/2021,5,"Super fresh, super clean and an extra nice staff who are very accommodating and always properly masked! Everything we've had here has been excellent. I'm someone that will only eat Sushi at spots that are extremely fresh and this is. Some of the things I really like about eating here and makes me recommend it is that they have something for any time of day. Wether its a quick snack of edamame, dumplings or a 4pc sushi roll, a lighter meal of one of their mini-Poke bowls or a full combination Bento Box with sushi, a hot entree & side, this a great spot any time of day. Their Milk Teas with or without Boba are also an excellent sweet treat. I also like that for a casual dining place they have a fairly extensive menu and their protein selection is excellent. I don't remember them all but there are 5 different Salmon choices (Regular, smoked, Poke marinated, Spicy & Teriyaki) Tuna, Yellow Tail, Krab, Egg, Tofu and more. Everything we have eaten here so far, we would have again. We catered a small party of 8 on New Year's Eve from here and everyone raved about it. So if you're looking for something different or something new, I highly recommend trying Bento."
5/14/2022,5,"I've had complaints in the past, but this place really has it together. Good luck picking something on the menu, because it's all good. You have a tough choice there, but I recommend the yellow curry rice bowl."
2/18/2021,5,"Disclosure: I'm Asian so I'm picky AF when it comes to Asian food.  For lunch I ordered the chicken pad Thai and it was so yummy.  A bonus is that, with tax it was under $10 (cheaper than the menu pictures on Yelp).  The food took about 5 minutes to make and the portions were huge; about 40% bigger than I probably needed as a grown man.  I can't wait to come back and try other menu items."
10/8/2019,4,"Came by yesterday for lunch with Orphan George and Orphan Rick after hearing that this place opened up in Boca from my boys as we had been to a similar one in Davie FL.I was quite excited to hear it was local and upon entering we found it very well lit and decor was nice and modern.When you enter you pick up a menu that is extensive and can be a bit confusing but for the first timers I would highly recommend the Bento Box as a starter which has a white or brown rice, green beans, a salad with ginger dressing, crispy fried triangles lol and noodles as your base, then you order your main course and it is added to the box and that way you get to flavor a little of everything.George ordered the Sesame Chicken, Rick had the Gen Tso's chicken and I had the Katsu Chicken with the yellow curry sauce (served separately) and all our meals were delicious.  Soft drinks are available on tap and refills are free (they could however do with a bit better variety)!All in all we had a very good meal and decently priced even though it was in ""the Boca"".  I would definitely give this place a thumb's up for my fellow Yelpers and will definitely be back with the rest of the Orphans and the family."
3/8/2021,4,"There is indoor dining and the place is really neat. The food here is pretty good for its price. It's not exactly the tastiest asian food i've had but it's not bad either. I do like their chicken with rice or noodles a lot better than their sushi. I feel like it's better ""quality"". I am a really big fan of their milk tea. I really like the strawberry flavor with strawberry boba."
4/20/2021,5,"This food taste amazing! Establishment is very clean, well mannered employees and again, the food was amazing. I had a poke bowl, made with love! Will always order when in town!"
7/2/2020,5,We went here because we were craving Asian food and our favorite place had closed. We got the Orange bento box and sesame chicken stir fry. Both were amazing and the strawberry soda was very different. It's different because there's a marble that you push out the cap that's in the drink. Overall very good food and would definitely go back.
11/19/2019,3,Decided to try something new so we came here. Atmosphere is very nice and everything was very clean.  While ordering we were a little confused how to order and got really not directions on how to. We order the kids meal for my daughter and she loved it! I got a bento box which I loved also. I also got a honey boba tea. My drink didn't come out until I actually went back up to the cashier to get it (which was sitting on the counter for how ever long). I was a little upset because I asked the waiter where the drink was and he told me he would go find out. We had already finished the meal before we got it. The drink was definitely a green tea but the cashier insisted that it was honey dew. They offered to make a new one but I didn't want to wait any longer. We left it there. Food was great but I think the staff needed a little more training and better customer service.
5/20/2021,1,"They give you enough food, unfortunately the boba tea tastes horrible. The noodles remind me of linguini noodles and tasted nasty. The Korean salad was far from a Korean salad. The main course in the box (Korean) was decent. Sadly I won't be coming back. For the price it was a big disappointment."
7/4/2021,1,"Unorganized and unprofessional staff. Waited 30 minutes for my food when my last 15 minutes I was the only customer in the store. No one came to explain why it was taking so long it just seemed like the norm. No explanation upon request for refund either. The management in the store at this time should be switched or I'm not sure how this place will stay open. The foods not even all that good, I just went cos it was one of 2 restaurants open in the area on the holiday."
9/12/2019,5,"This is brand new at this location. I LOVE this place. (Mom and I ate at the one in Tallahassee)The food is fresh and plentiful.  Staff was very nice, and food came out fast and hot. It takes a while to place your order, because if you haven't eaten there before, the person at the register has to explain to you how it's done. The food I'd NOT over salted."
4/11/2020,5,I ordered a delivery and I was surprised how quickly the order arrived and still warm.The udon soup was delicious and the teriyaki rice also delicious both a large serving. We also had spring rolls which were crispy but not greasy.Door dash is the only way I would order.
8/23/2020,1,"Oufff, first time ever ordering from Bento and this is what I see when I'm pretty much done with it, eww, where is the quality control, not just 1 but 2 items that shouldn't be in my food. 1 white string and 1 long piece of plastic. Grossed out, the food was good but this unacceptable."
3/10/2021,5,"Ordered take out for lunch a few times. Tried their Mongolian beef with rice , pad Thai and coconut curry. I liked all of those dishes. I was surprised how good they were. I have yet to try the sushi but I think this is an amazing place to have lunch."
3/7/2021,3,"I have a sweet spot for Bento from going here weekly in college. But this location is very hit or miss for me. The food is inconsistent. Sometimes prepared differently or with substituted ingredients. For takeout, the wait times are never accurate. It's been a year into this pandemic and their soda fountain is still not open? So you're forced to buy a water bottle for 25 cents. My meal is typically very dry so I get stuck buying an extra sauce for 50 cents. I'll still keep coming here occasionally but it's definitely not as good as I remember or want it to be. Fun fact: each entree comes with a free sauce, it's not advertised at all but it does."
11/19/2019,5,"So happy that Bento finally opened a location in the Boca area. I can now get my fix in of Pao Pao Chicken (Spicy Cream) without having to drive to Davie. Been to this location multiple times already and couldn't be more pleased. Super consistent, fast and tasty every time!"
10/5/2019,4,"I don't venture this far often but I got a reason to now! I had a mixed greens poke bowl with spicy tuna and Asian Cajun steak. I added asparagus, jalapeños, cream cheese, mango, and avocado. Then I topped it with fried garlic and pickled ginger. Lastly I added yuzu ponzu. I have not been that quite eating a ""salad"" in a long time. It was truly delicious. One thing I really loved about the restaurant was the hand washing station. Having a wild boy it's always great to have a spot to wash his hands quickly because I never know what he has touched or played with. However, the staff was unwilling to let me sample the sauces while ordering my food or my sons. And the dish that children's meals are served in slip and slide all over the table. I had to really make sure he did not accidentally knock it off the table."
6/14/2021,5,One of my favorite spots when I'm around the Boca area. Food is always fresh and place is always clean.
6/10/2021,2,The food is pretty good but with recent price hikes I don't think it's worth it is now almost 17 dollars for a full meal without a drink. There portions also seem to be smaller. The staff there is nice and helpful but it's not a reasonable value for the new pricing.
3/3/2020,5,"I have not been WOWED by a restaurant in a while, but Bento wowed me! The food was absolutely amazing. The Mongolian Beef Bento Box is my new jam! Everything on the plate was fantastic! The quality is great, portions are perfect and the service is quick! Love love love it!!"
9/8/2019,5,"I've been to a few locations in Orlando and absolutely love Bento! Food is decently priced, efficient  and it's in a great location in park plaza. This will definitely become a favorite for the Boca community. The restaurant is modern with plenty of inside and outside seating. When you walk in you see a menu and wait in line to order at the counter. They give you a number so the staff can bring out your meal. Their menu includes sushi, poke bowls, combo boxes and on the other side of the menu sides, soups, noodle or rice bowls, boba teas. It looks like they will have a selection of beer coming soon! I'm so excited for Bento to be opening more locations here in south florida. I usually always get the sushi combo box but now that it is closer to home, I can try more menu items."
2/1/2021,4,"The pao pao shrimp/chicken is great 85% of the time. The lost star is for the inconsistency. But when it's good, it's really good."
5/30/2020,4,Good clean fresh fish.  Rice was perfect.Smaller portion size - not fat guy compatible.
