dates,reviews,comments
9/1/2017,5,"Watch out Pei Wei! This place deserves 5 stars as I have never imagined I could get a curry fix from a fast food place. For only $8 you get a very well portioned bowl with your choice of white rice, brown rice, or noodles. You also can choose your choice of protein and boy oh boy you get quite the selection. This time around I chose the Red Curry with chicken and brown rice. If you're a fan of spicy curry dishes I would highly suggest it."
7/20/2017,5,"This place is great. Been here twice since the first time. Many interesting beverage options that I thoroughly enjoy and their bento box is a nice variety, pretty big and filling. Great lunch/quick dinner place"
3/6/2017,4,"I'm not even going to lie, I'm a Pei Wei loyalist. Bento is however, much nicer interior and so much cleaner and sophisticated I feel like. Idk if its because this location is super brand new.Plenty of free parking because its in a big shopping plaza next to halal guys etc.Bento just might have slightly bigger portions or bigger plates idk lol. Great service. Staff was on top and good on follow up. Price range more or less the same.Ordered Mongolian beef here and it was served very freshly hot. Taste is ehhh I think Pei Wei mongolian beef is definitely way better and sweeter.Bentos crab rangoons were almost the same as Pei weis but Bentos is thickerIf there is anything I do recommend here is their spicy chicken with cream sauce or something. That shit was delicious.Oh and their white rice is very different here.Over all pretty good"
8/31/2017,5,"Really glad we finally have a Bento in South Florida! Used to eat at Bento with friends all the time in Orlando when I attended UCF. This location is really clean, quick service, and has awesome customer service. I would go in to detail about how delicious the food is here.. but just come out here and explore the food for yourself.I recommend spicy cream chicken rice bowl, Miami roll, and the steak is usually good here too! If you're in the mood for a slush.. ask for a passion fruit & lychee mix (I personally don't like Boba, so I get it w/o it... deeelish)."
1/1/2021,1,Took way to long for food to come out. I got my food after waiting 45 minutes my daughter did not get her food which all she ordered was a simple avocado roll. I WAS DONE WITH MY FOOD before hers even came out.Very bad service they DO NOT know how to serve.
9/17/2017,4,"I've been here twice and each time it was very crowded and I was in a rush so I couldn't stay and eat. The plaza this restaurant is located in is very busy and hectic to get in and out of. Add that to the fact that they are in close proximity to three college campuses and you get a very crowded restaurant. That's really my only negative and if I were being completely honest, it's really just a nitpick. The concept isn't original, but it's one that I love and I'm happy to see catching on. The service is really good as the food gets to you pretty fast. I tried the boba tea the first time I was here and loved it. The second time I tried the sriracha garlic chicken with udon noodles and now I'm officially hooked. I also apperciate that they give you the option to substitute tofu for any of the meats in their dishes since that means I'll be able to bring my vegan friend next time."
12/29/2017,3,"I had pickup so I can't really speak much on the dine in experience but I got a Korean shrimp bowl with an almond milk tea smoothie. The bowl was pretty uneventful. Not at all spicy and it was just... lacking something. The boba tea was good but that wasn't what I came there for! The ambience is very nice, the environment was buzzing. Seems like a nice place to sit down and eat so I'll probably go back and give them another go but try something different."
5/14/2017,4,"MmmMm Bentos! The taste of Asian Cuisine with variety of sushi rolls, noodles to rice entrees and delicious sides. Oh yea! Can't forget the Sweet Boba Teas. They have a modern look decor going on with plenty of table spaces for dining. It is seat at your own risk, so if you have a large group I suggest that someone from your group save that spot prior to ordering. The menu has 2 sides, sushi side and an entree side. It can be a bit confusing of how to order but the easy instructions up top the menu has the 1-2-3. So it can't be that hard :0)The dish I always get is the spicy cream chicken OR spicy cream shrimp with brown rice. I alternate here and there but these are my go to dishes. The spicy cream is not that hot; it has the spicy mayo base taste. Love love love it! The dish is balanced with a side of green beans. I tried to make the veggie at home but it was not the same at all. This had a crunch to it as you chew it and saltiness balanced the entree. A great Boba Tea to get us the Thai Ice tea. You can never go wrong with that! When never we make a family trip to Bentos, it's always an exciting treat for all of us!"
11/22/2020,3,Food was alright. I liked the atmosphere and customer service was good. The kitchen was clean and service was speedy. Thanks!
8/19/2020,2,I usually have a 5 star experience with bento but this was the first time I had issues. My wife's friend placed an online order at 5:50 pm and when I got there at 6:15 they couldn't find the order. We placed about an 80 dollar order and there seemed to be some confusion regarding the order once I got there. They couldn't find the name and just came back and said if it was under someone else. I showed them the screen shot of the order items and that the card was charged and I waited some more. Around 6:30 went and went back in again to see if they figured out the status of the order. They said the order scheduled for 6:40 pick up. I confirmed with my friend and it showed ASAP. Finally got the order almost an hour later while many of the people who placed their orders while I was waiting received theirs. Finally get home and there was some things missing and had to call them and drive back to pick it up. They're usually great I've been going since they've been in Gville and Orlando. First time I had an issue and usual have great experience but today was not good.
2/18/2018,5,"Crazy obsessed with Bento. It's an order and they bring your food to you environment. Every time I have gone, the service has been fast throughout the whole process. I'd say every time my food is at my table within 6 minutes or so. They are like ninjas at Bento while at the same time the food is phenomenal. There are many menu option from wok, to sushi, and poke bowls. You can also customize pretty much any meal you choose! Get the bubble tea too!"
2/2/2017,5,"I have been obsessed with Bento Cafe for years in Orlando. Every time I visited I had to go! I was thrilled to find out another location popped up and not too far away from me!This location is set up differently, with a quick service feel. i went during lunch and the line was massive! but trust me it's worth the wait!My go to has always been the SPICY CREAM CHICKEN omg it's amazing! Not too spicy and you can make it hotter if you want to. I usually go for the bento box which will give you rice, noodles, string beans and a little dessert. But I opted for the kids meal which is the spicy cream chicken, rice and string beans just a smaller portion. Then I wanted to try one of their sushi rolls and I was thrilled to find out they had boba! That milk tea with the boba inside is sooo yummy nice little treat!You order at the counter, the staff is nice and helpful then you get a number to put on your table. It didn't take too long to get the food delivered to your table. The food here is amazing! The spicy cream sauce is so tasty, I could put it on everything. The chicken is in small bites, not greasy or fatty at all. The cook their string beans with various spices so it really makes having your veggies enjoyable! I opted for the brown rice to make myself feel like I was balancing out the sweet boba tea. I went for a spicy crunch sushi roll to stay with a similar theme of the chicken. It was a good sized portion and lots of crunch sprinkles!Overall I had a great lunch and look forward to coming back again soon!"
7/11/2017,4,"What a great place.     First, it's large inside..didn't expect that when walking in.  Really nice modern decor.   My wife and I split two entrees..a poke bowl for spicy tuna and a roll that had no rice.   Everything was very very fresh.    2 days later I found myself wanting another 'poke' bowl.   So good and felt 'clean' (eating).   I just wish there was one closer to CS / Parkland area.    Maybe one day!"
8/18/2017,3,"Inexpensive, which is great. But the food is low quality. The sushi is not fresh and the noodles were undercooked. Bubble tea was good though."
11/15/2019,1,Rude ass manager MJ (mahali) was rude over some damn ginger ale this place doesn't let you customize your food either which i don't get even if you offer to pay additional Gave this place another try and it's just not it the guy who made my slushie went from cleaning straight to making my slushie without washing his hands and he was right by a sink i had to tell him wash his hands he didn't know i was watching they are unsanitary
9/23/2019,3,"So I went here with my friends for dinner the other night. The place itself is nice and clean. It was pretty packed when we went. However, the food was very basic. I got sushi and it wasn't all that tasteful. I only rated this 3 star based on the food taste otherwise the customer service was very good. They replaced my food for me because I had ordered uncooked salmon by mistake. But will I return here again? Probably not."
6/17/2018,5,This is my first time eating here! My daughter told me she would go to the Gainesville location back in college so I decided why not for Fathers Day. It wasn't packed which was great since I didn't want to wait for hours to sit down at a restaurant. Ordered a tofu sirarcha noodle and it was the best tofu meal I've ever had! Definitely will be back for more.
9/14/2017,1,"I visited the day before hurricane Irma came, as they were one of the few places to be open. Tried their cucumber avocado roll, it's was delicious! Went back to get the same thing after the hurricane, and I don't know if the food had gone spoiled without them knowing during the hurricane, but unfortunately I got food poisoning from the roll. I'm okay now, still recovering, probably won't go back though."
3/7/2017,4,"I have been the Bento is Gainesville, two of the locations in Orlando, and now this one in South Florida. For the most part, they were all pretty consistent with the taste and look of their  food.  The front of the house and food runners were all super friendly and quick.  When you come in you grab a menu and take a look at what you would like, then you go to the registers and order. They give you a number that you bring with you to the table when you sit. The drink fountain is towards the back along with silverware and napkins that you can get yourself.My sister had two strands of hair that were inside of the spicy cream chicken she ordered. We notified one of the employees passing by and he quickly went to get who I believe was a manager. She took care of the situation very quickly and gave her some edamame while she waited for them to remake her food.  Other than that situation, the rest of our food was great. My favorites from Bento are definitely the spicy cream chicken, red curry katsu, and their whole sushi menu.Great place to come with friends!"
12/9/2017,3,"Disappointed.. food is somewhat cold not that great very commercial. They sweep while customers are eating and there's also flies. :( On the positive note if you don't care about the latter, the line goes by fast and the service is great."
1/3/2017,5,"This is the place to go for quick fresh sushi on a quick lunch run. Trendy and clean in design and gives you the option to go for bowls, rolls or sashimi platters. It's conveniently located in Plantation Town Center shops and parking is convenient. Large seating areas either tables, long booths or by the sushi bar. Very quick service and friendly staff that brings orders to your tables. And the sushi is of course super fresh and delicious. My reason for making this place my favorite lunch stop for sushi."
10/24/2019,4,"Very good tasting sushi! I had the Flying dragon and a Cali roll. I love how you can customize things. I rate it a 4 because there was no ice in the vending machine and had to drink a room temperature water. But I would come back, great service."
6/5/2017,5,"I have to say this is a new all time favorite for some nice, quick, and delicious food.I went on Saturday and it was packed, but enough space where 8 of us where able to find a table. I went for dinner, so I am not sure how it gets during lunch.It does get full, but I went around 8pm and was able to find seating.Food: the food here is pretty good, I had the Sushi combo box, which allows you to grab two different 4 pieces, and 8 piece California roll; this comes along with some wakame seaweed and imitation crab. I also ordered the garlic edamame and they were also pretty good. I had family members that had the Poke bowl, Udon soup, and the Taiwanese rice noodles, and they mentioned it was pretty good as well.Price: the price range was not bad for what you get, $10 for 16 pieces was not bad, the edamame was a bit pricey for me, but it tasted good.The prices of the other items are not bad, because they do not cheat you out of portioning.The sushi is a bit small, but still very filling and delicious.Environment: the service is great, they will bring the food to you, they did take a big longer than usual to bring us our food, and the lady couldn't find us, but nothing outrageous. the restaurant is actually very spacious, and even though it gets packed, you do not feel as if you were cramped in there.Overall, this is a new favorite that I cannot wait to go back to.The price is right, the the food is good, and it is overall a nice place to enjoy."
3/30/2017,5,I'm a poke bowl conesueir. I found this spot a few months ago. Now everyone and their mom goes. It never disappoints. Fast friendly service and delicious food. Will be back again and again! Great prices!
7/22/2017,4,"Delicious. Tried something different each time and every time it's been very tasty. Tried noodle bowls, poke bowls, bento boxes, and sushi plates and all are good. Not 5 stars because the order takers/servers are pretty cold and have no personality....very impersonal. Kind of pricey too for lunch. But definitely going to be a regular place for us."
12/19/2016,5,"Bento has always been one of my favorites in college and I am so happy it is now in Broward. I can't wait until they expand more all over so I can eat it everyday. I will never get sick of the sushi and hot food for an affordable price. The ambiance and staff is well trained, quick and always ready. There's always a line out the door when I go though, but that's how good it is. It's relatively quick though."
2/1/2018,5,Its a cool little spot. Well lit. Pretty busy. The food is so good!.. it hot. It's fresh. It's fast. Well worth it!!
5/30/2017,5,"Konichiwa! this place is just great. Ordered a bowl mixed with salmon with tuna and was truly great. The prices are fair, fast service, great menu and selections. Had also some sushi and soup with no complaints. Finally found a place that i can come back regularly without having a bad experience. One of the most cool things is the Coca Cola machine that has all the flavors, i love that machine because it gives you different options on what to drink at the place. Cant wait to come back Thank you for existing !."
4/20/2018,4,"Good food, my main disappointment is the plastic sauce cups that come even with dine-in orders. It is very wasteful. Especially confusing since they had an earth day sign at the register  ...."
11/19/2019,5,"This is my favorite restaurant,we will come to eat once a week,the variety is also special.My mother and my son love to eat"
1/3/2017,4,"The second this place opened the lines were out the door and there's still a crowd. I've been to bentos up in Gainesville and Orlando and the only thing lacking at this location is the quality of the sushi. I like the sushi rolls at the other locations better. The place is really clean and a lot of seating available. My favorite thing to order is the spicy cream chicken; in a brown rice bowl, mini udon bowl, or a bento box. I go for the bento box if I want a little bit of everything and not be too full. The mini udon is really good but super filling. The portions are pretty big, so you'll be full and probably have leftovers. The curry katsu with red curry is pretty good if you want a bit of spice. The service is pretty good. It just depends on what time you go, but normally the food doesn't take too long."
7/9/2019,5,"I have eaten at several Poke spots in Fort Lauderdale area, but I still come back to Bento's Hawaiian bowl.  It is still my favorite."
5/16/2017,4,"I was hesitant about trying this place because a friend of mine had a bad experience there. The place is new and clean. You walk up to the register, order your food, and wait at the table for someone to find your number and deliver the food. I ordered the chicken and shrimp general tso bento box and it was delicious. The bento box included the protein, brown rice, noodles, green beens, a salad, and fried wonton pieces with a sweet sauce. The food was fresh and tasty. The portions are very generous and I was able to eat the rest for dinner. The fried wonton pieces were stale but over all, I had a good experience and I can't wait to try other items on their menu."
11/2/2018,5,"Fast-casual asian food done right! I've been to a couple Bento locations in Orlando and this one has to be my favorite. Whenever I can't decide what I want for lunch or dinner, Bento is my go to. I always call to order for pickup and it's seamless every time, usually ready within 15 mins or less. Everything is really efficient and food is great and reasonably priced. I'm a fan of their poke bowls, and spicy cream noodle bowls/bento boxes (think they call it pao pao sauce now). Definitely check it out if you're ever in the Davie area."
8/6/2019,3,"This is my second time eating here, first time take out. I was helped by a really sweet woman named Aleeha and the place was filled with lunch time customers but I was helped fast and waited less than 10 mins for my food. I went with the sushi bento box and a miso soup. The box came with a salad, some type of cold noodle dish, a california roll and four pieces each of the bagel roll and mt fuji roll. The rolls were pretty good and tasted fresh, the surprise was the noodles. They have a weird almost slimy consistency to them but they were delish. The soup was great, nice flavorful broth. The disappointment was my jasmine milk tea. I had asked if I could mix flavors with it and was told I couldn't so I just went with a standard jasmine milk tea with boba, one of my go to drinks. It was awful, I threw it all away. It was very bitter, no sweetness to it. I'll definitely be back to try their hot foods."
9/24/2019,2,"Bento has a fun vibe and some delicious food options.  However, I have had several negative experiences that prevent me from going back.  On two separate occasions, I was served potstickers that were frozen in the middle.  When I asked for another dish as a replacement, my request was refused as the cost was ""too much"".  Additionally, I have severe shellfish and peanut allergies that can be avoided if kept separate from other foods.  When I made that request, the cashier made no notation of it on my order, and I had an allergic reaction afterward.  I do not appreciate this lack of accommodation and have no desire to return to this restaurant.  Allergy sufferers, be on guard!"
12/13/2016,2,"This is obviously a chain restaurant, which I try to stay away from, especially when it comes to sushi. I knew this place had recently opened so I looked it up and decided to call in a pick up order. Thank goodness for that. This place was packed! there wasn't an empty seat in the house and there were several parties waiting to order in line. I made my way through over to the pick up area. Cashier was very nice. I payed for my order and went home.My fiance ordered a bento box. It had Mongolian steak (very fatty), ginger salad, noodles(tasteless), white rice, and another side. He also ordered a California roll and Miso soup. The Miso soup was delicious. I ordered the wakame salad and a Bamboo roll, which were both okay. Overall, it wasn't terrible, but I've had waaaaaaaay better sushi. I would have given it three stars, but our stomach aches afterwards forced me to give it a two."
2/10/2019,5,The bento box and poke bowl are amazing! Can't go wrong with any combination. I usually do the red curry shrimp bento or the spicy tuna poke bowl. Bubble tea options are great too!
4/22/2019,3,"This isn't bad for lunch but definitely wouldn't be my go to spot. There are definitely better places to eat at for Asian cuisine and this place was just mediocre to me. I wouldn't go out of my way to come here. Their bubble tea is a bland, definitely not worth the money I paid for. My friend got the Mongolian beef and it was too salty. I got the chicken katsu...it wasn't bad but I had better. The lomein noodles weren't that great in my opinion, it lacked flavor and seemed a little on the dry side."
3/7/2017,5,"Really yummy Asian food!!! Similar to pei Wei but with a lot more options! You order at the counter & then they bring you your food to your table. They have a full sushi menu with rolls, hand rolls, & ahi tuna bowls. They also have a create your own noodle/rice dish with various meat, veggie, & sauce options! I picked beef udon noodles with veggies & a yummy Szechuan sauce. The food came fresh and full of yummy flavor! The portions are a good amount & my stomach was left happy. Not to mention the cute cashiers... Lol highly recommend this spot for lunch or dinner! Heard it can get really busy around lunch time."
9/17/2016,5,"So glad to see this place in SoFlo! Been eyeing this place with KC ever since the 'coming soon' signs were posted on their windows. To our expectations, it pretty much fulfilled every aspect of the other Bento Cafes we've been to up North, despite the hectic first week rush and new hirees!As soon as we walked in we were already in line. It was a full house, on a Thursday too! The line didn't progress as fast as we'd hope for but luckily we weren't starving. It's self seating so 'strategize' accordingly hahah.My usual is the Spicy Salmon and Tuna Bowl but instead I went for the 'build your own' and maxed out on their protein of 3. Here's my breakdown: White Rice / Salmon, Spicy Salmon, and Spicy Tuna / Avocado, Masago, Tempura Flakes, Wakame / Spicy Mayo, White SaucePortion was perfect for it's price (11ish) and I think I've found my new go-to! Okay maybe the bowl isn't new in comparison but I was uber satisfied. Had the Thai Tea with no boba and it was pretty solid. KC ended up getting her original favorite, Spicy Cream Shrimp with Mini Udon Noodles. It was my first time trying it and it was yummy as well. Tough decisions will be made next visit. She also had the Honey Dew Milk Tea with Lychee Jelly. It was too sweet for my taste and the consistency seemed a bit grainy. Midway of our meal the place emptied out and it seems like we just caught a wave at the wrong time. So in reality the wait isn't consistently terrible, at least for a weekday. Will surely be back for my poke bowl cravings and hopefully a Bento Blue emerges further South!"
12/27/2016,5,"I've tried a few different poke bowl places but this one is my current favorite. You can choose from a variety of different toppings to add on top of the bowl. I order the poke salmon and the fish is always fresh. There is plenty of seating inside the restaurant and never a long wait. They have a huge menu: wok stir fry, sushi rolls, bento box, poke, noodle and rice bowls. They also have a ton of boba tea flavors."
5/30/2017,5,"I was so happy to learn that Bentos opened down here! Back home I went to this place all the time. I usually order the bento box with the Mexican roll, cali roll, and Mount Fuji. Let me tell you about the Mount Fuji. Once you get this roll you will always order it. My husband even likes it and he HATES sushi so that should tell you something. My husband usually gets the teriyaki bowl with noodles and he always enjoys it. The food always comes out fast here so you don't want long to get it."
3/2/2017,5,"I loved the create your own poke bowl. The portions were big and the fish was fresh and delicious.The bento boxes were also huge.Everything was tasty and the place is clean and lively. Furthermore, the prices were very reasonable, especially considering the quality of the food.Eating here again is on my ""to do"" list next time I'm in Florida. There were many interesting items on the menu I'd love to try when I visit again.Now, if only they would open in NYC....."
4/21/2017,5,"Perfect spot for quick service Asian cuisine. There was a review that mentioned how long the lunch rush line was, and I have to agree with that. There was a long line, however, we seemed to come as the lunch rush was starting to go down so we were able to grab a table with no wait. They have a lot of servers picking up tables and cleaning them for a quick turnaround. The food was very good. I could taste good quality and it was freshly prepared. I had a sushi roll that was delicious, and my kids had chicken fried rice that they ate up entirely. Husband had a noodle bowl that was great too. All the dishes being served looked great and appetizing. We are happy with our experience and definitely plan on returning. Enjoy!"
