dates,reviews,comments
12/10/2016,5,Food is fresh and reasonably priced. We recently had Zeph(server) help us and he was very friendly and helpful. Easy place to go with or without the kids.
11/16/2016,5,"For the price, the food is great and the quality is there. We've always had good service and enjoyed every dish we tried. You must try Bento if you're looking for a quick, affordable Asian cuisine option for lunch! I should warn you that it can get quite busy, so plan accordingly if you have a limited amount of time for lunch!"
10/30/2016,1,Have been trying to call for pick-up for half an hour and it just rings and then disconnects.
11/14/2016,4,First tried it in Orlando and I'm so happy that there's a location here! I always get a salmon poke bowl or the stir fry tofu udon. Their rolls are great too! Nice dine in atmosphere.
11/18/2017,4,really good food- easy lunches with healthy options- sometimes the person cashing out can be clueless about toppings otherwise recommended
9/1/2022,4,"Four stars for being by far the best Bento restaurant I've been too! I've only been to one and this is the second lol but I loved the decor and layout of the restaurant. I thought it was pretty cool how they have a only hand washing sink next to the soda machine. We came in an hour prior to close so we didn't wait much at all for the food. The cashier was very friendly, patient and attentive! We were a group of five and couple of us had never been here. Even though I praised the inside, we ate outside as the night temperature was welcoming. I ended up cleaning the table myself as it was dirty.The food came out delicious! It was at the right temperature, not piping hot, and I wanna say ""fresh"" but I can tell the noodles were out for awhile BUT nonetheless delicious. The sushi was amazing! Had the TNT which was the best! The rainbow roll was ok, had better. The boba tea is AMAZING here! Wow! Super delicious and exquisite. Definitely get your boba tea fix here. Everyone here was friendly, social and helpful. I asked for a plastic container and the employee told me in very warm and friendly way that the to go boxes can hold liquid and assured me my leftovers will make it home. :) Overall, I had a pretty amazing experience here."
9/3/2022,3,"Nice to find a stir fried noodle dish with lots of veggies and protein, good for the family to share.Service took a bit longer and pricing seemed a little high. But overall, happy to find this place walkable from the Marriott Fort Lauderdale Airport hotel that we were staying at."
8/21/2022,3,"Located in Dania Point, this restaurant is nestled between Lime and In Ramen.  Upon entering, you can pick up a menu at the end of the line so you know what you want by the time it's your turn to order.  I ordered the Szechuan Chicken Bowl with fried rice.  I then took a seat at a table and waited approximately 5 minutes for the food. It arrived piping hot and the portion appeared to be large.  Besides chicken, there was an assortment of vegetables: zucchini, carrots, beans, etc.  The Szechuan flavor was not the greatest. However, the fried rice was amazing! The rice was actually the best part of the dish."
12/17/2022,1,"Food wrong twice for dine in, didn't receive my boba until we were completely finished, they literally gave me just plain salmon over rice and didn't add any sauce or toppings and said that is how the bowl comes lol. So bland and not enough food. Maybe the bento is good but the poke was awful."
7/28/2022,1,"I so very much wanted to love this place. I will give 5 stars to the young lady who rang me up and offered suggestions.5 stars to the warm white rice in the bento box but 1 star for the lukewarm/cold food. The tofu was fried/dried so much that it was edible. This was my first time so I do not know if this is the way that it is served. Total disappointment and waste of money. And it was not cheap either.It was nice that they have a sink for hand washing at the beverage station. I did not write this review right away since I contacted the ""we care share your experience"" website with no response as of today. :-("
3/4/2022,3,"I really want to give this location a great review, unfortunately it just is not consistent enough. When it hits it HITS but when it misses it misses. The Miami role is delicious! Always hits! The other options, order at your own risk. The green beans had little flavor even tho they were covered in garlic. Lo mein also had very little flavor despite having onions and carrots. Would come back only for the sushi"
12/9/2022,4,The BEST customer service and the sweetest staff. The only issue is the boba. The taro and the honey boba is quite literally the worst tasting boba I've ever had. The texture was as if they overcooked the pearls and the taste of the taro was way off. Definitely choose another flavor and don't get the pearls. I also tried the mango tea with lychee jelly it was DELICIOUS!
12/31/2021,4,Stopped in first time for lunch and ordered a bento sushi box with choice of rolls. I designate sushi as this place has both hot and cold boxes. I was very hungry so wanted the variety and quantity of items. This truly delivered very flavorful and fresh. When you go inside you order and they bring your order to your table. For this visit I chose outside since I was in need of fresh air as well as Covid free germs. Also I ordered a bottle of Fuji water which is my favorite. My two choices of rolls were Spicy Tuna and Mt. Fuji they had me at eel sauce made for a beautiful presentation I even had fellow diners ask what was I eating as the Mt. Fuji looks beautiful with the crab on top. Bento box is $15. well worth the price for a delicious lunch.
6/4/2022,5,"If you're in the mood for quick good Asian food, you can never go wrong with bento. The portions are pretty large and actually not that bad for the wallet. Definitely better than a Panda Express or a hole-in-the-wall Asian spot in my opinion. Bobas always taste fresh and delicious"
5/14/2022,3,"Three.5 stars  it's about right for this place it was not so bad... I don't have much to say but a couple of dishes we bought they are okay... Bento Box  it's pretty descent Noodle Bowl  wasn't bad... just lacked a flavor, Pao Pao chicken  2.5 stars"
5/22/2022,3,"I ordered their bento box to include prawns in a yellow curry. The portion is very generous. The salad had a very nice ginger dressing. The noodles were pleasant, the side green beans were also a hit. However, I was very disappointed in the yellow curry sauce, it seemed generic, globby and not particularly authentic in the taste, to be honest. The vegetables also seem to be thrown in from frozen, as they appeared watery. The prawns however were plentiful, large and cooked through. I would come again, but would NOT choose the yellow curry, but would try something else, maybe a stir fry."
3/2/2022,4,"Stopped in for a quick lunch and was excited to see the restaurant was booming with business!For starters, the customer service was amazing and majority of the staff working there truly looked like they were enjoying themselves. In my eyes, that means the food is being prepared with attention and care! I came in and the incredible list of flavors and options were slightly intimidating, but with the help of one of the employees, I was recommended the Gochujang Garlic Chicken Bento Box which was super tasty. The Bento Box includes lo mein, your choice of white or brown rice, sautéed garlic green beans, a ginger salad and your choice of entree, mine being the Gochujang Garlic Chicken. The chicken was the perfect mix of sweet and spicy and also a hefty portion and the ginger salad was a mix of cucumber, cherry tomatoes and a proper salad mix with romaine. The other sides were just okay. Along with this, I ordered a Peach Green Boba Tea which was decent, nothing much to rave about and too sweet for my liking. Overall, a decent lunch option!"
5/22/2022,1,The food is to much greasy. Is a fast food asian food and is not cheapThe place was empty the service vas regular but the food is not goof
6/14/2021,3,"This is the 3rd location I've tried, and still... the one in Davie in the plaza with Home Depot near NOVA University is the best location hands down! Reason being... this place was empty, maybe 2 customers dining inside. My party and I sat outside and thete were tables that weren't cleaned or picked up. Ordered crab wontons. I don't think the employee who fried them knows how to drain off excess oil or even fried them at the right temperature because oil should not be pouring out of the wontons (see photos of oil in the plate and on a napkin). The employee at the register didn't know how to answer our menu questions and guessed answers lolI think from now on, I'll just stick to the Davie location."
11/16/2021,3,"Fast food sushi and poke bowls are ok by me.  Ended up eating here twice in a weekend because it was next to my hotel and 1) I love Poke, and 2) I was hungover often... so yeah this place was my cure.Easy ordering system - pay at the counter, you'll get a number and they'll bring it to your table.  And nice staff. I love places that have custom poke bowls, as well as some pre-set options as my mom isn't good at creating her own.  Portion size is pretty good for the price.  One complaint, the ice or drink machine is super loud, and, ok two complaints, I was always freezing inside."
12/11/2021,4,We ordered two orders of sushi and a noodle bowl. The sushi was fantastic!  Spicy tuna and Miami roll we're super delicious and fresh. The tuna was minced and mild tasting. The Miami roll had shrimp on top and crab inside. That roll was outstanding. The noodles were a little bit too saucy but the vegetables and noodles done to perfection. We sat outside on a beautiful night and enjoyed our meal. If I lived here I would definitely come back here.  Patio is spacious and lots of indoor seating. Wonderful menu good for families. Reasonable prices.
5/13/2022,1,"Found a dead bug in my poke bowl today. Didn't even receive a sorry when I called to let them know. Unfortunately it was a pick up order, so I didn't even realize it until I got home."
3/9/2021,4,"We'd been to the Bento in Boca (which is in an area of schools and business) and liked it. I'd read about this restaurant t chain from Howard H's yelp reviews. So when we saw this location, we figured we'd try it and compare. This smaller location is in a more locals and touristy area of Dania Pointe -- in a row of fast food restaurants.  We chose to eat inside as it was windy out, but there are outside tables, as well. You order and pay at the counter and they bring your food to your table. We'd tried their bento boxes at the other location. It was so much food that I decided to go with a smaller option. Howard had written about his usual dish and I decided to try it. I ordered the bowl with chicken katsu and Japanese curry. You can get it over rice or noodles. I wanted ramen, but they no longer offer them, so I chose lomein noodles. The other noodle option is udon which is fatter and wider. There was a lot of chicken in the dish. Each piece is panko battered and fried then cut into long wide strips. It was served on top of the spaghetti-like noodles. Mixed in to the seasoned noodles were some carrots. The curry was served on the side. It was slightly sweet and very very good. I can see why Howard always orders this. I wound up taking some of the chicken and curry sauce home for a later meal. My husband ordered their coconut red curry with added shrimp -- also as a bowl over noodles. There were a blend of vegetables mixed into the slightly spicy curry. And several shrimp on top. He also liked his dish as well. For fast casual Japanese food, this is really quite good. And the prices are also reasonable -- especially for the amount of food in each serving. We also received our meals fairly fast even though they were quite busy. Service was friendly although there was a bit of a language problem. I asked what was in a particular dish and the gal taking our order just kept repeating a memorized line over and over again. It was kind of funny, but I was trying to make sure nothing was in it that I might be allergic to and/or didn't like. Just to be sure, I ordered something else than I was originally going to get. That was the only minor glitch though. And yes, I'd certainly try them again when looking for an inexpensive fast food Japanese meal."
2/21/2021,4,"I visited this restaurant in the Boca location and always thought their food is good.  Since this new location in Dania Pointe just opened recently, I knew I had to pay a visit.In this visit, I came by to pick up a couple of lunch orders on a Friday.  I arrived around 11 am just after they had just opened the shop.  Maybe because they just recently opened so the staff had not finished preparing the food yet, I had to wait about 30 minutes to get my food.But I guess it was worth the wait.  My chicken katsu tasted great.  I ordered my chicken with Japanese Curry and it was delicious.  The rice was cooked right which was soft and fluffy.  My wife copied my order and she also enjoyed it very much.I'd probably come back maybe during the weekend because a 30-minute wait is just way too long on a working week.  They offer a large variety in their menu so I am sure I can probably pick up something else to enjoy."
3/22/2022,4,"I feel like a three star review is appropriate, though I am giving them a four star review o accommodating our large group for a local Bible study on a biweekly basis. The rolls are small but the fish seems to be quality and the taste is very good. I got the sushi box and was pleased with flavor, one star for portion. Maybe smaller sushi roll I've ever witnessed. Salad dressing and veggie dressing were both good. Great location and parking. Nice and spacious place. Beats other fast food options."
1/9/2021,3,"Yesterday was my second time getting lunch from Bento in Dania. The first time was through uber eats when I ordered a very underwhelming egg fried rice. This time around I placed a take out order through Yelp. It was super easy!I like how they have small orders of rolls so that way you can mix and match. I decided on the Mex Roll, the JB Roll and a chocolate milk tea.The JB roll was good. The salmon is smoked which is not my preference, but that's just a personal taste. I thought the Mex Roll was delicious and would return just for that.My total with tip was just over $17 which for sushi is not uncommon, however, the rolls were so incredibly tiny (size not amount of pieces). There are other sushi restaurants in the area that definitely give you more bang for your buck."
7/10/2022,1,"Don't give this place your money unless your extremely desperate and about to die from starvation. The service was beyond horrible, but what can you expect from a place that hires kids that probably already don't make shit. The sushi that I ordered tasted exactly the same. I also ordered the boba and I was super excited to try the boba.... that was disappointing. If I could give a negative five star review I would."
10/25/2022,3,"MID BOBA, Boba was not good. tapioca is made terrible, and FOUR DOLLARS FOR FRIED RICE, the gentrifiers have done it again. (Food was pretty alright though). WIPB( Jack, Luc, Jeff)"
8/31/2022,5,"Needed a quick lunch with a business partner. We  both did like the quality and portion of the food, the service, and the cleanliness.  I checked the bathroom and felt completely confident to eat there."
7/23/2021,1,"I should have known better than to call in an order at 10pm when they closed at 10:30pm, but I really wanted a veggie roll. When I walked in the pick up the order, they were obviously cleaning for closing or sitting in their phones. Of course that weren't happy about me being there so late, I know I know. But the veggie roll tasted like everything in it was expired, down to the cream cheese. I ate 2 pieces and spit the 3rd one out, fearing that I may get sick. The color of the veggies were a bit off as well. The spring roll was still good though.I will stick to the Davie location moving forward, as I never have a problem there."
5/8/2022,1,"insanely slow service and borderline rudeone girl up front trying to work both the register with a long line, while also making the boba teas.  meanwhile the other staff is barely moving"
7/4/2022,5,"Had the lava roll ,which is basically like a volcano sushi roll, and  red curry chicken bowl. Both were very good !!"
7/10/2022,5,"Great great food everything was super fresh and clean, the  ginger salad  the service super fast"
4/15/2022,1,"Forgot about one of our orders - we waited 2 HOURS for some sushi rolls (easiest thing to make) & reminded them MULTIPLE times. obviously they have no management. (Paid OVER $66 - for a terrible experience. Might as well take your money somewhere else)They kept messing up everyone's orders and mixing up peoples meals, it's a huge mess. Food is subpar - compared to other bentos when I order the same thing. They put two people with the same order number - so our food was left sitting there getting cold unless we got up and went back inside to ask where's our food?? They finally put two and two together. Than waited even more time (over an hour or 2) to get a simple box of sushi. They also made us wait an hour for a boba tea order - once we got it it was all watered down. So what was the point of waiting? It's not like they made anything better with their ""special ingredient"" that they made us wait for. Don't let the new fancy location fool you - they suck might as well go somewhere else where they know how to at least train their employees correctly.They also have no manners (when you're nice to them and polite) they just maintain a straight face ,Throw you your food and don't care. I understand times are tough - but ethically you need to take any job you take in a high regard if that's the job in which you applied for."
4/18/2021,1,"This review is written on behalf of my bf who had an unpleasant experience here. Months ago, we came here together and ALSO didn't have a great experience considering that our food took longer than it should. The manager (an older gentleman) gave us a free drink card that night.Fast forward, my bf came recently came and claimed the drink and ordered a sushi roll for lunch. Upon arrival, he was not greeted. A girl at the front, Angelina, just blatantly stared at him. He took it upon himself to ask ""hello, how are you?"" And still, no response. She still doesn't say a word nor ask how he can be helped. As he orders, this girl gives major attitude and presses buttons on the screen really hard. When asking her what his options are, she continued to stay mute and points at it. And when she did speak, it seems like she's purposely mumbling so she can't be heard. Upon reviewing of what he ordered, she still tried to charge him for the drink. Overall, she was rude. So many things went wrong at this point, and clearly we are clueless on where the customer service is? And HOW this is kind of behavior is acceptable?My bf doesn't ever complain about anything like this but he felt like this experience could've been prevented. He even asked someone at the meal prep station if he could speak to the manager and waited AGAIN, longer than he should. He had to remind them a second time to bring a manager out. Nevertheless, the manager (Maria) was useless. She didn't seem to know what she was doing or clearly how to handle the situation. Not really apologetic to what took place, and was more defensive with her staff. Not everyone can provide excellent customer service, but AT LEAST have decent manners. Not sure how a business can operate with people who can't even do a simple task of greeting their guests, let alone helping with their order."
1/18/2022,1,Maybe not the best place.  At the end of the day is my opinion so give this place a try at your own risk. From 1-10 I'll give this place a 3. Miso soup was watery no flavor. The The noodles on my bento was cold. The protein was great. Hospitality was fair. Environment was ok. For me was disappointing.
5/16/2022,1,Ordered a poke bowl online and found it sitting on the counter when I walked in. Poke bowls have raw fish in them... Had food poisoning for three days straight after. I hope somebody from health department pays them a visit soon.
4/17/2022,1,"Disgraceful service. Cashiers need to be trained on how to deal with customers. While I wait d an ETERNITY for my order, I gave up after 20 min and asked to speak with a manager. The ENTIRE staff at the restaurant had no idea where the manager was and were surprised to find out that the manager had abruptly quit. I got my refund and advised customers behind me NOT to eat at this establishment. Was a sad site to see all the confusion between the line cooks and prep staff. This establishment needs serious help! Will never EVER eat or order food from here EVER AGAIN!"
9/19/2021,1,"Son, I am disappoint... very, very disappoint.This is essentially cheap, conveyor belt 70s Chinese kitchen takeout slop, just re-marketed and repackaged with a more updated look/feel. If it has an app, it must be different! Completely bland and uninspired. Fresh but not flavorful or memorable at all. Seems like cheap GFS kind of  stuff. The decor, location and website/app market it out to be a lot nicer than what you get. Its not bad, really, just meh. I literally could have taken my family to the Chinese buffet down the street for 1/3 the cost, and it really would have tasted better. I don't have a problem paying premium prices for premium fast food. But this just doesn't cut it. They say gen Z is more about the 'experience' but come on, even they have to realize this is just rebranded 70s slop, just without the flavor.The staff and modern decor were great. The rest.... Stick to the MSG... seriously..."
3/13/2021,3,"Man it pains me to give this place 3 stars. This was my fave fast casual asian dining in college- the Pao Pao (spicy creamy) chicken bowl is incredible. People literally flew it to me when I left college and lived in MD. But I've been 6 times now and have had something wrong with my order EVERY time. Expect it to take longer than 30 min whether you dine in or order ahead. Only one of six times was it ready under the 20 min mark. There are some issues from the online ordering site to what prints out for the kitchen. A couple of examples- I ordered lo mein and got a side of plain udon noodles, I said no mushrooms and there were mushrooms, I asked for a side of veggies and there was no side of veggies....it goes on. Check your order before you leave!! Once I ordered it on ubereats. They even managed to send me the wrong persons food! When I called them, they recognized their mistake and asked if I could come in to pick up the correct food because Uber had already closed the order. If ANY other place had this many issues I would not go back. But that Pao Pao sauce is worth the eye rolls, and it's a great price point. So I say go, but know what you're getting into! Or maybe try another Florida location because I've never had issues like this with any of the others!"
1/11/2021,3,"If I had to choose between Pei Wei, Panda Express, or Bento... I'm not entirely sure I'd pick Bento. I think that it's great they offer quick and convenient Asian-style food, and they even offer inexpensive sushi. The sushi, however, is all I enjoyed of my meal. The red curry with tofu was kind of tragic. I know that's harsh, but wow, so was the taste of the curry. The noodles with chicken that I got were absolutely swimming in sauce. I don't even remember what I got because I just remember the abundance of sauce. I'm not saying I wouldn't go back. I'd just strictly get sushi."
9/13/2022,2,This place is vile. Fast food sushi garbage. Fish previously frozen. Bland is a compliment. The rice is like glue. The miso soup is like sipping on salt. Straight up disgusting. Will never go back!
3/6/2022,2,I love the Bento place in Davie and this one was a disappointment. For the high price for fast food sushi it did not meet the standards. Salad was yucky and the pickle salad had no flavor. The rolls were tiny tiny. I will not be coming back to I should of taken a picture of my rolls.
2/15/2022,2,$66 dollars last Friday with my family ... kids meal had peppers in it and my orange chicken was brown in the inside . I didn't know they were going to use dark meat . Disappointed especially for the price .
11/25/2020,1,"We ordered 2 poke bowls for pickup, long wait when we arrived, mass chaos with their team members trying to figure out orders. They just opened so that is completely understandable. However in one of our bowls we found this, not sure what it attached to the cream cheese but we didn't want to find out and threw away both bowls. I tried reaching out to them through email and social media 2 weeks ago and have not received a response. So here's your 1 star review."
8/19/2022,2,I gave this restaurant two Stars only because of the cleanliness. Normally this place would have received a one star if that. Let me start with a warning. If you order chicken and it tastes like fish looks like fish and the staff tries to convince you that it's not fish you should really consider was this the right restaurant choice. My wife had Pad Thai with shrimp I'm not sure who came up with this Chef inspired idea of adding barbecue sauce to Pad Thai but it just doesn't work. You know the food is bad when you place it on the back of your tongue to try to avoid the taste of it. I would not recommend this place to my worst enemy and I absolutely hate him.
